{
  "$schema": "https://json-schema.org/draft/2020-12/schema",
  "$id": "https://shared-intake-governance.local/schemas/profile.schema.json",
  "title": "ProfileConfig",
  "type": "object",
  "additionalProperties": false,
  "required": [
    "profile_id",
    "description",
    "accepted_sources",
    "keywords",
    "output_mode"
  ],
  "properties": {
    "profile_id": {
      "type": "string",
      "minLength": 1,
      "pattern": "^[A-Za-z0-9][A-Za-z0-9._-]*$"
    },
    "description": {
      "type": "string",
      "minLength": 1
    },
    "accepted_sources": {
      "type": "array",
      "items": {
        "type": "string",
        "enum": [
          "github_repo",
          "github_releases",
          "github_search",
          "arxiv_query",
          "rss",
          "news",
          "custom"
        ]
      }
    },
    "keywords": {
      "type": "array",
      "items": {
        "type": "string"
      }
    },
    "required_risk_flags_absent": {
      "type": "array",
      "items": {
        "type": "string"
      },
      "default": []
    },
    "output_mode": {
      "type": "string",
      "enum": [
        "research_digest",
        "benchmark_brief",
        "news_brief",
        "custom"
      ]
    },
    "provider_preferences": {
      "type": "array",
      "items": {
        "type": "string",
        "enum": [
          "claude",
          "gemini",
          "agy",
          "vibe"
        ]
      }
    }
  }
}
