{
  "profile_id": "agent-bench-lab",
  "description": "Benchmark and eval tracking for coding-agent benchmarks, verifiers, contamination resistance, and benchmark methodology.",
  "accepted_sources": [
    "github_repo",
    "github_search",
    "arxiv_query",
    "rss",
    "news"
  ],
  "keywords": [
    "benchmark",
    "verifier",
    "swe-agent",
    "terminal-bench",
    "deepswe",
    "contamination"
  ],
  "required_risk_flags_absent": [
    "instruction_like_content"
  ],
  "output_mode": "benchmark_brief",
  "provider_preferences": [
    "claude",
    "gemini"
  ]
}
